13-277 spi-1: 34
1998-2262 spi-1: BE
3982-4247 spi-1: FA
5967-6232 spi-1: FE
7952-8216 spi-1: EB
9970-10234 spi-1: FF
11954-12219 spi-1: CF
13939-14203 spi-1: 3C
99612-99876 spi-1: 34
101630-101894 spi-1: BE
103614-103879 spi-1: FA
105599-105864 spi-1: FE
107584-107848 spi-1: EB
109602-109866 spi-1: FF
111586-111851 spi-1: CF
113571-113837 spi-1: 3C
197259-197524 spi-1: 34
199244-199508 spi-1: BE
201262-201526 spi-1: FA
203246-203511 spi-1: FE
205231-205496 spi-1: EB
207216-207480 spi-1: FF
209234-209498 spi-1: CF
211218-211483 spi-1: 3C
298909-299175 spi-1: 34
300894-301158 spi-1: BE
302878-303143 spi-1: FA
304863-305128 spi-1: FE
306848-307112 spi-1: EA
308866-309130 spi-1: FF
310850-311115 spi-1: CF
312835-313101 spi-1: 3C
396523-396788 spi-1: 34
398508-398774 spi-1: BE
400526-400790 spi-1: FA
402510-402775 spi-1: FE
404495-404760 spi-1: EA
406480-406744 spi-1: FF
408498-408762 spi-1: CF
410482-410747 spi-1: 3C
496155-496420 spi-1: 34
498140-498406 spi-1: BE
500158-500422 spi-1: FA
502142-502407 spi-1: FE
504127-504392 spi-1: EA
506112-506376 spi-1: FF
508130-508394 spi-1: CF
510114-510379 spi-1: 3C
595787-596052 spi-1: 34
597772-598038 spi-1: BE
599790-600054 spi-1: FA
601774-602039 spi-1: FE
603759-604024 spi-1: EA
605744-606008 spi-1: FF
607762-608026 spi-1: CF
609746-610011 spi-1: 3C
697437-697702 spi-1: 34
699422-699686 spi-1: BE
701407-701671 spi-1: FA
703391-703656 spi-1: FE
705376-705640 spi-1: EA
707394-707658 spi-1: FF
709378-709643 spi-1: CF
711363-711628 spi-1: 3C
795051-795316 spi-1: 34
797069-797334 spi-1: BE
799054-799318 spi-1: FA
801039-801303 spi-1: FE
803023-803288 spi-1: EA
805008-805272 spi-1: FF
807026-807290 spi-1: CF
809010-809275 spi-1: 3C
894683-894948 spi-1: 34
896701-896966 spi-1: BE
898719-898983 spi-1: FA
900671-900935 spi-1: FE
902655-902920 spi-1: EA
904640-904904 spi-1: FF
906658-906922 spi-1: CF
908642-908907 spi-1: 3C
994315-994580 spi-1: 34
996333-996598 spi-1: BE
998318-998582 spi-1: FA
1000303-1000567 spi-1: FE
1002287-1002552 spi-1: EA
1004305-1004570 spi-1: FF
1006290-1006554 spi-1: CF
1008274-1008539 spi-1: 3C
1095965-1096230 spi-1: 34
1097950-1098214 spi-1: BE
1099935-1100199 spi-1: FA
1101919-1102184 spi-1: FE
1103937-1104202 spi-1: EA
1105922-1106186 spi-1: FF
1107906-1108171 spi-1: CF
1109891-1110156 spi-1: 3C
1193579-1193844 spi-1: 34
1195597-1195862 spi-1: BE
1197648-1197913 spi-1: FA
1199567-1199831 spi-1: FE
1201551-1201816 spi-1: EA
1203536-1203802 spi-1: FF
1205785-1206050 spi-1: CF
1207538-1207803 spi-1: 3C
1295229-1295494 spi-1: 34
1297214-1297478 spi-1: BE
1299199-1299463 spi-1: FA
1301183-1301448 spi-1: FE
1303201-1303466 spi-1: EA
1305186-1305450 spi-1: FF
1307170-1307435 spi-1: CF
1309155-1309420 spi-1: 3C
1392910-1393174 spi-1: 34
1394861-1395126 spi-1: BE
1396846-1397110 spi-1: FA
1398831-1399095 spi-1: FE
1400815-1401080 spi-1: EA
1402833-1403098 spi-1: FF
1404818-1405082 spi-1: CF
1406803-1407067 spi-1: 3C
1492475-1492740 spi-1: 34
1494493-1494758 spi-1: BE
1496478-1496742 spi-1: FA
1498463-1498727 spi-1: FE
1500447-1500712 spi-1: EA
1502465-1502730 spi-1: FF
1504450-1504714 spi-1: CF
1506435-1506699 spi-1: 3C
1592107-1592372 spi-1: 94
1594125-1594390 spi-1: BE
1596110-1596374 spi-1: FA
1598095-1598359 spi-1: FE
1600079-1600344 spi-1: EA
1602097-1602362 spi-1: FF
1604214-1604479 spi-1: AF
1606067-1606331 spi-1: 9C
1691739-1692004 spi-1: B4
1693757-1694022 spi-1: BE
1695775-1696041 spi-1: FA
1697727-1697991 spi-1: FE
1699711-1699976 spi-1: EA
1701729-1701994 spi-1: FF
1703747-1704011 spi-1: AF
1705699-1705963 spi-1: BC
1791371-1791636 spi-1: B4
1793389-1793654 spi-1: BE
1795374-1795638 spi-1: FA
1797359-1797623 spi-1: FE
1799343-1799608 spi-1: EA
1801361-1801626 spi-1: FF
1803379-1803643 spi-1: AF
1805331-1805595 spi-1: BC
1891003-1891268 spi-1: 94
1893021-1893286 spi-1: BE
1895006-1895270 spi-1: FA
1896991-1897255 spi-1: FE
1898975-1899240 spi-1: EA
1900993-1901258 spi-1: FF
1902978-1903242 spi-1: AF
1904963-1905227 spi-1: 9C
1990635-1990900 spi-1: B4
1992653-1992918 spi-1: BE
1994638-1994902 spi-1: FA
1996656-1996920 spi-1: FE
1998607-1998872 spi-1: EA
2000658-2000923 spi-1: FF
2002610-2002874 spi-1: BF
2004595-2004859 spi-1: BC
2090267-2090532 spi-1: B4
2092285-2092550 spi-1: BE
2094270-2094534 spi-1: FA
2096255-2096519 spi-1: FE
2098471-2098735 spi-1: EA
2100257-2100522 spi-1: FF
2102242-2102506 spi-1: BF
2104227-2104491 spi-1: BC
2189899-2190164 spi-1: B4
2191917-2192182 spi-1: BE
2193902-2194166 spi-1: FA
2195887-2196151 spi-1: FE
2197871-2198136 spi-1: EA
2199889-2200154 spi-1: FF
2201874-2202138 spi-1: BF
2203859-2204123 spi-1: BC
2289531-2289796 spi-1: B4
2291549-2291814 spi-1: BE
2293534-2293798 spi-1: FA
2295519-2295783 spi-1: FE
2297503-2297768 spi-1: EA
2299686-2299951 spi-1: FF
2301506-2301770 spi-1: BF
2303491-2303755 spi-1: BC
2389197-2389461 spi-1: B4
2391181-2391446 spi-1: BE
2393166-2393430 spi-1: FA
2395151-2395415 spi-1: FE
2397135-2397400 spi-1: EA
2399153-2399418 spi-1: FF
2401138-2401402 spi-1: BF
2403123-2403387 spi-1: BC
2488795-2489060 spi-1: 34
2490813-2491078 spi-1: BE
2492798-2493062 spi-1: FA
2494783-2495047 spi-1: FE
2496800-2497065 spi-1: F8
2498785-2499050 spi-1: FF
2500770-2501034 spi-1: BF
2502755-2503019 spi-1: 3C
2588427-2588692 spi-1: 34
2590445-2590710 spi-1: BE
2592430-2592694 spi-1: FA
2594481-2594745 spi-1: FE
2596399-2596664 spi-1: FA
2598417-2598682 spi-1: FF
2600402-2600666 spi-1: BF
2602387-2602651 spi-1: 3C
2688093-2688357 spi-1: 34
2690077-2690342 spi-1: BE
2692062-2692328 spi-1: FA
2694047-2694311 spi-1: FE
2696031-2696296 spi-1: FC
2698049-2698314 spi-1: FF
2700034-2700298 spi-1: BF
2702019-2702283 spi-1: 3C
2787725-2787989 spi-1: 34
2789709-2789974 spi-1: BE
2791694-2791960 spi-1: FA
2793679-2793943 spi-1: FE
2795663-2795928 spi-1: FE
2797681-2797946 spi-1: FF
2799666-2799930 spi-1: BF
2801651-2801915 spi-1: 3C
2885339-2885603 spi-1: 34
2887323-2887588 spi-1: BE
2889341-2889606 spi-1: FA
2891326-2891592 spi-1: FE
2893311-2893575 spi-1: FF
2895295-2895560 spi-1: FF
2897313-2897578 spi-1: BF
2899298-2899562 spi-1: 3C
2986989-2987253 spi-1: 34
2988973-2989238 spi-1: BE
2990958-2991224 spi-1: FA
2992943-2993207 spi-1: FF
2994927-2995192 spi-1: A7
2996945-2997210 spi-1: FF
2998930-2999194 spi-1: BF
3000915-3001179 spi-1: 3C
3086621-3086885 spi-1: 34
3088605-3088870 spi-1: BE
3090590-3090856 spi-1: FA
3092575-3092839 spi-1: FF
3094559-3094824 spi-1: A9
3096577-3096842 spi-1: FF
3098562-3098826 spi-1: BF
3100547-3100811 spi-1: 3C
3186253-3186517 spi-1: 34
3188237-3188502 spi-1: BE
3190222-3190488 spi-1: FA
3192207-3192471 spi-1: FF
3194191-3194456 spi-1: AB
3196209-3196474 spi-1: FF
3198194-3198458 spi-1: BF
3200212-3200476 spi-1: 3C
3285885-3286149 spi-1: 34
3287869-3288134 spi-1: BE
3289854-3290120 spi-1: FA
3291839-3292103 spi-1: FF
3293823-3294088 spi-1: AB
3295841-3296106 spi-1: FF
3297826-3298090 spi-1: BF
3299811-3300075 spi-1: 3C
3385517-3385781 spi-1: 34
3387501-3387766 spi-1: BE
3389486-3389752 spi-1: FA
3391471-3391735 spi-1: FF
3393455-3393720 spi-1: AD
3395506-3395771 spi-1: FF
3397458-3397722 spi-1: BF
3399443-3399707 spi-1: 3C
3485149-3485413 spi-1: 34
3487133-3487398 spi-1: BE
3489118-3489384 spi-1: FA
3491169-3491433 spi-1: FF
3493120-3493385 spi-1: AF
3495105-3495370 spi-1: FF
3497090-3497354 spi-1: BF
3499075-3499339 spi-1: 3C
3584781-3585045 spi-1: 34
3586765-3587030 spi-1: BE
3588783-3589048 spi-1: FA
3590735-3590999 spi-1: FF
3592753-3593017 spi-1: B7
3594737-3595002 spi-1: FF
3596722-3596986 spi-1: BF
3598707-3598971 spi-1: 3C
3684413-3684677 spi-1: 94
3686629-3686893 spi-1: BE
3688382-3688648 spi-1: FA
3690367-3690631 spi-1: FF
3692385-3692649 spi-1: B9
3694369-3694634 spi-1: FF
3696354-3696618 spi-1: CF
3698339-3698603 spi-1: 9C
3782060-3782324 spi-1: 34
3784045-3784309 spi-1: BE
3786029-3786294 spi-1: FA
3788014-3788280 spi-1: FF
3789999-3790263 spi-1: B9
3792017-3792281 spi-1: FF
3794001-3794266 spi-1: CF
3795986-3796250 spi-1: 3C
3883677-3883941 spi-1: 34
3885661-3885926 spi-1: BE
3887646-3887912 spi-1: FA
3889631-3889895 spi-1: FF
3891649-3891913 spi-1: B9
3893633-3893898 spi-1: FF
3895618-3895882 spi-1: CF
3897603-3897867 spi-1: 3C
3983309-3983573 spi-1: 14
3985293-3985558 spi-1: BE
3987344-3987609 spi-1: FA
3989263-3989527 spi-1: FF
3991280-3991545 spi-1: B9
3993265-3993530 spi-1: FF
3995250-3995514 spi-1: CF
3997235-3997499 spi-1: 1C
4082941-4083205 spi-1: 34
4084925-4085190 spi-1: BE
4086910-4087176 spi-1: FA
4088895-4089159 spi-1: FF
4090912-4091177 spi-1: B9
4092897-4093162 spi-1: FF
4094915-4095181 spi-1: CF
4096867-4097131 spi-1: 3C
4182573-4182837 spi-1: 34
4184557-4184822 spi-1: BE
4186575-4186840 spi-1: FA
4188527-4188791 spi-1: FF
4190544-4190809 spi-1: B9
4192529-4192794 spi-1: FF
1387673-1414616 rnsMfd2-1: 0xCA
1414616-1439324 rnsMfd2-1: 0x34
1439324-1464031 rnsMfd2-1: 0x1A
1464031-1493210 rnsMfd2-1: 0xE5
1689036-1715980 rnsMfd2-1: 0xCA
1715980-1740687 rnsMfd2-1: 0x34
1740687-1763158 rnsMfd2-1: 0x28
1763158-1794574 rnsMfd2-1: 0xD7
3537226-3564169 rnsMfd2-1: 0xCA
3564169-3588877 rnsMfd2-1: 0x34
3588877-3615820 rnsMfd2-1: 0x27
3615820-3642763 rnsMfd2-1: 0xD8
3839523-3866467 rnsMfd2-1: 0xCA
3866467-3891174 rnsMfd2-1: 0x34
3891174-3913645 rnsMfd2-1: 0x28
3913645-3945061 rnsMfd2-1: 0xD7
4194514-4194778 spi-1: CF
4196499-4196763 spi-1: 3C
4280253-4280519 spi-1: 34
4282205-4282469 spi-1: BE
4284189-4284454 spi-1: FA
4286174-4286440 spi-1: FF
4288159-4288423 spi-1: B9
4290176-4290441 spi-1: FF
4292161-4292426 spi-1: CF
4294344-4294609 spi-1: 3C
4379852-4380116 spi-1: 34
4381837-4382101 spi-1: BE
4383821-4384086 spi-1: FA
4385806-4386072 spi-1: FF
4387923-4388189 spi-1: B9
4389808-4390073 spi-1: FF
4391793-4392058 spi-1: CF
4393778-4394042 spi-1: 3C
4481469-4481733 spi-1: 34
4483453-4483718 spi-1: BE
4485438-4485704 spi-1: FA
4487423-4487687 spi-1: FF
4489440-4489705 spi-1: B9
4491425-4491690 spi-1: FF
4493410-4493674 spi-1: CF
4495395-4495659 spi-1: 3C
4581101-4581365 spi-1: 34
4583350-4583614 spi-1: BE
4585070-4585336 spi-1: FA
4587055-4587319 spi-1: FF
4589072-4589337 spi-1: B9
4591057-4591322 spi-1: FF
4593042-4593306 spi-1: CF
4595027-4595291 spi-1: 3C
4680733-4680997 spi-1: 34
4682717-4682982 spi-1: BE
4684702-4684968 spi-1: FA
4686687-4686951 spi-1: FF
4688704-4688969 spi-1: B9
4690689-4690954 spi-1: FF
4692674-4692938 spi-1: CF
4694956-4695221 spi-1: 3C
4780365-4780629 spi-1: 34
4782349-4782614 spi-1: BE
4784334-4784600 spi-1: FA
4786319-4786583 spi-1: FF
4788336-4788601 spi-1: B8
