13-278 spi-1: 34
1998-2263 spi-1: BE
4016-4280 spi-1: FA
6001-6265 spi-1: FE
7985-8250 spi-1: CB
9970-10236 spi-1: FF
11988-12252 spi-1: CF
13972-14237 spi-1: 3C
101663-101928 spi-1: 34
103648-103912 spi-1: BE
105633-105897 spi-1: FA
107650-107915 spi-1: FE
109635-109900 spi-1: CB
111620-111884 spi-1: FF
113604-113869 spi-1: CF
115589-115854 spi-1: 3C
199277-199542 spi-1: 34
201295-201560 spi-1: BE
203280-203544 spi-1: FA
205265-205529 spi-1: FE
207249-207514 spi-1: CB
209234-209500 spi-1: FF
211252-211516 spi-1: CF
213236-213501 spi-1: 3C
298909-299174 spi-1: 34
300927-301192 spi-1: BE
302912-303176 spi-1: FA
305128-305393 spi-1: FE
306881-307146 spi-1: CB
308866-309132 spi-1: FF
310884-311148 spi-1: CF
312868-313133 spi-1: 3C
398574-398839 spi-1: 34
400559-400824 spi-1: BE
402544-402808 spi-1: FA
404529-404793 spi-1: FE
406513-406778 spi-1: CB
408531-408796 spi-1: FF
410516-410780 spi-1: CF
412500-412765 spi-1: 3C
498173-498438 spi-1: 34
500191-500456 spi-1: BE
502176-502440 spi-1: FA
504161-504425 spi-1: FE
506145-506410 spi-1: CB
508163-508428 spi-1: FF
510181-510445 spi-1: CF
512132-512397 spi-1: 3C
597805-598070 spi-1: 34
599823-600088 spi-1: BE
601808-602072 spi-1: FA
603793-604057 spi-1: FE
605777-606042 spi-1: CB
607795-608060 spi-1: FF
609780-610044 spi-1: CF
611764-612029 spi-1: 3C
699455-699720 spi-1: 34
701440-701704 spi-1: BE
703425-703689 spi-1: FA
705575-705839 spi-1: FE
707427-707692 spi-1: CB
709412-709676 spi-1: FF
711396-711661 spi-1: CF
713381-713646 spi-1: 3C
797069-797334 spi-1: 34
799087-799352 spi-1: BE
801072-801336 spi-1: FA
803057-803321 spi-1: FE
805041-805306 spi-1: CB
807059-807324 spi-1: FF
809044-809308 spi-1: CF
811028-811293 spi-1: 3C
896701-896966 spi-1: 34
898719-898984 spi-1: BE
900704-900968 spi-1: FA
902722-902986 spi-1: FE
904673-904938 spi-1: CB
906691-906956 spi-1: FF
908676-908940 spi-1: CF
910660-910925 spi-1: 3C
996333-996598 spi-1: 34
998351-998616 spi-1: BE
1000336-1000600 spi-1: FA
1002321-1002585 spi-1: FE
1004305-1004570 spi-1: CA
1006323-1006588 spi-1: FF
1008308-1008572 spi-1: CF
1010292-1010557 spi-1: 3C
1095965-1096230 spi-1: 34
1097983-1098248 spi-1: BE
1099968-1100232 spi-1: FA
1101953-1102217 spi-1: FE
1103937-1104202 spi-1: CA
1106054-1106319 spi-1: FF
1107940-1108204 spi-1: CF
1109924-1110189 spi-1: 3C
1195597-1195862 spi-1: 34
1197615-1197880 spi-1: BE
1199765-1200030 spi-1: FA
1201618-1201882 spi-1: FE
1203569-1203834 spi-1: CA
1205587-1205852 spi-1: FF
1207572-1207836 spi-1: CF
1209556-1209821 spi-1: 3C
1295262-1295527 spi-1: 34
1297247-1297512 spi-1: BE
1299265-1299531 spi-1: FA
1301217-1301481 spi-1: FE
1303201-1303466 spi-1: CA
1305219-1305484 spi-1: FF
1307204-1307468 spi-1: CF
1309188-1309453 spi-1: 3C
1394861-1395126 spi-1: 34
1396879-1397144 spi-1: BE
1398864-1399128 spi-1: FA
1400849-1401113 spi-1: FE
1402833-1403098 spi-1: CA
1404884-1405149 spi-1: FF
1406836-1407100 spi-1: CF
1408820-1409085 spi-1: 3C
1494493-1494758 spi-1: 34
1496511-1496776 spi-1: BE
1498496-1498760 spi-1: FA
1500481-1500745 spi-1: FE
1502465-1502730 spi-1: CA
1504483-1504748 spi-1: FF
1506534-1506798 spi-1: CF
1508452-1508717 spi-1: 3C
1594125-1594390 spi-1: 34
1596143-1596408 spi-1: BE
1598128-1598392 spi-1: FA
1600278-1600544 spi-1: FE
1602097-1602362 spi-1: CA
1604115-1604380 spi-1: FF
1606100-1606364 spi-1: CF
1608084-1608349 spi-1: 3C
1695775-1696040 spi-1: 34
1697760-1698024 spi-1: BE
1699745-1700009 spi-1: FA
1701729-1701994 spi-1: FE
1703747-1704012 spi-1: CA
1705732-1705996 spi-1: FF
1707716-1707981 spi-1: CF
1709701-1709966 spi-1: 3C
1793389-1793654 spi-1: 34
1795407-1795672 spi-1: BE
1797392-1797656 spi-1: FA
1799377-1799641 spi-1: FE
1801361-1801626 spi-1: CA
1803379-1803644 spi-1: FF
1805430-1805694 spi-1: CF
1807348-1807613 spi-1: 3C
1893054-1893319 spi-1: 34
1895039-1895304 spi-1: BE
1897024-1897288 spi-1: FA
1899009-1899273 spi-1: FE
1900993-1901258 spi-1: CA
1903011-1903276 spi-1: FF
1904996-1905260 spi-1: CF
1907014-1907278 spi-1: 3C
1990669-1990933 spi-1: 94
1992653-1992918 spi-1: BE
1994671-1994936 spi-1: F9
1996656-1996920 spi-1: FF
1998641-1998905 spi-1: FF
2000625-2000890 spi-1: FF
2002643-2002908 spi-1: AF
2004628-2004892 spi-1: 9C
2092318-2092583 spi-1: B4
2094303-2094568 spi-1: BE
2096288-2096552 spi-1: F9
2098273-2098537 spi-1: FF
2100257-2100522 spi-1: FF
2102275-2102540 spi-1: FF
2104260-2104524 spi-1: AF
2106244-2106509 spi-1: BC
2189966-2190230 spi-1: B4
2191917-2192182 spi-1: BE
2194001-2194266 spi-1: F9
2195920-2196184 spi-1: FF
2197905-2198169 spi-1: FF
2199889-2200154 spi-1: FF
2201907-2202173 spi-1: AF
2203892-2204156 spi-1: BC
2291582-2291847 spi-1: 94
2293567-2293832 spi-1: BE
2295552-2295816 spi-1: F9
2297570-2297834 spi-1: FF
2299554-2299819 spi-1: FF
2301539-2301805 spi-1: FF
2303524-2303788 spi-1: AF
2305508-2305773 spi-1: 9C
2389197-2389461 spi-1: B4
2391181-2391446 spi-1: BE
2393199-2393464 spi-1: F9
2395184-2395448 spi-1: FF
2397168-2397433 spi-1: FF
2399153-2399418 spi-1: FF
2401171-2401437 spi-1: AF
2403156-2403420 spi-1: BC
2490846-2491111 spi-1: B4
2492831-2493096 spi-1: BE
2494816-2495080 spi-1: F9
2496800-2497065 spi-1: FF
2498785-2499050 spi-1: FF
2500803-2501069 spi-1: FF
2502788-2503052 spi-1: AF
2504772-2505037 spi-1: BC
2590478-2590743 spi-1: 94
2592463-2592728 spi-1: BE
2594448-2594712 spi-1: F9
2596432-2596697 spi-1: FF
2598417-2598682 spi-1: FF
2600468-2600734 spi-1: DF
2602420-2602684 spi-1: AF
2604404-2604669 spi-1: 9C
2690110-2690375 spi-1: B4
2692095-2692361 spi-1: BE
2694080-2694344 spi-1: F9
2696064-2696329 spi-1: FF
2698049-2698314 spi-1: FF
2700067-2700331 spi-1: DF
2702052-2702316 spi-1: AF
2704036-2704301 spi-1: BC
2789742-2790007 spi-1: 34
2791727-2791993 spi-1: BE
2793712-2793976 spi-1: F9
2795696-2795961 spi-1: FF
2797681-2797946 spi-1: FF
2799699-2799963 spi-1: DF
2801684-2801948 spi-1: CF
2803668-2803933 spi-1: 3C
2889374-2889639 spi-1: 14
2891359-2891625 spi-1: BE
2893344-2893608 spi-1: F9
2895328-2895593 spi-1: FF
2897313-2897578 spi-1: FF
2899331-2899595 spi-1: DF
2901316-2901580 spi-1: CF
2903300-2903565 spi-1: 1C
2989006-2989271 spi-1: 34
2990991-2991257 spi-1: BE
2992976-2993240 spi-1: F9
2995027-2995291 spi-1: FF
2996978-2997243 spi-1: FF
2998963-2999227 spi-1: DF
3000981-3001245 spi-1: CF
3002932-3003197 spi-1: 3C
3088638-3088903 spi-1: 34
3090623-3090889 spi-1: BE
3092608-3092872 spi-1: F9
3094659-3094923 spi-1: FF
3096610-3096875 spi-1: FF
3098595-3098859 spi-1: DF
3100580-3100844 spi-1: CF
3102564-3102829 spi-1: 3C
3186252-3186517 spi-1: 14
3188270-3188535 spi-1: BE
3190255-3190521 spi-1: F9
3192240-3192504 spi-1: FF
3194224-3194489 spi-1: FF
3196242-3196507 spi-1: FF
3198227-3198491 spi-1: CF
3200212-3200476 spi-1: 1C
3287902-3288167 spi-1: 34
3289887-3290151 spi-1: BE
3291872-3292136 spi-1: F9
3293856-3294121 spi-1: FF
3295874-3296139 spi-1: FF
3297859-3298123 spi-1: FF
3299844-3300108 spi-1: CF
3302027-3302291 spi-1: 3C
3387534-3387799 spi-1: 34
3389519-3389783 spi-1: BE
3391504-3391768 spi-1: F9
3393488-3393753 spi-1: FF
3395605-3395870 spi-1: FF
3397491-3397755 spi-1: FF
3399476-3399740 spi-1: CF
3401460-3401725 spi-1: 3C
3487166-3487431 spi-1: 14
3489151-3489415 spi-1: BE
3491136-3491400 spi-1: F9
3493120-3493385 spi-1: FF
3495138-3495403 spi-1: FF
3497123-3497387 spi-1: FF
3499107-3499372 spi-1: CF
3501092-3501357 spi-1: 1C
3586798-3587063 spi-1: 34
3588816-3589082 spi-1: BE
3591032-3591297 spi-1: F9
3592752-3593017 spi-1: FF
3594770-3595035 spi-1: FF
3596755-3597019 spi-1: FF
3598739-3599004 spi-1: CF
3600724-3600989 spi-1: 3C
3688415-3688679 spi-1: 34
3690400-3690664 spi-1: BE
3692384-3692649 spi-1: F9
3694402-3694667 spi-1: FF
3696387-3696651 spi-1: FF
3698371-3698636 spi-1: FF
3700356-3700621 spi-1: CF
3702738-3703002 spi-1: 3C
3786062-3786327 spi-1: 14
3788047-3788311 spi-1: BE
3790032-3790296 spi-1: F9
3792016-3792281 spi-1: FF
3794034-3794299 spi-1: FF
3796019-3796283 spi-1: DF
3798003-3798268 spi-1: CF
3799988-3800253 spi-1: 1C
3885694-3885959 spi-1: 34
3887679-3887943 spi-1: BE
3889664-3889928 spi-1: F9
3891648-3891913 spi-1: FF
3893666-3893931 spi-1: FF
3895651-3895915 spi-1: DF
3897635-3897900 spi-1: CF
3899620-3899885 spi-1: 3C
3985326-3985591 spi-1: 34
3987311-3987575 spi-1: BE
3989296-3989560 spi-1: F9
3991512-3991776 spi-1: FF
3993298-3993563 spi-1: FF
3995283-3995547 spi-1: DF
3997267-3997532 spi-1: CF
3999318-3999583 spi-1: 3C
4086943-4087207 spi-1: 14
4088961-4089225 spi-1: BE
4090912-4091177 spi-1: F9
4092930-4093195 spi-1: FF
4094915-4095179 spi-1: FF
4096899-4097164 spi-1: DF
4098884-4099149 spi-1: CF
4100902-4101168 spi-1: 1C
4184590-4184855 spi-1: 34
4186575-4186839 spi-1: BE
4188560-4188824 spi-1: F9
4190544-4190809 spi-1: FF
4192562-4192827 spi-1: FF
1814935-1841879 rnsMfd2-1: 0xCA
1841879-1866586 rnsMfd2-1: 0x34
1866586-1895765 rnsMfd2-1: 0x1F
1895765-1920473 rnsMfd2-1: 0xE0
2116319-2143263 rnsMfd2-1: 0xCA
2143263-2167970 rnsMfd2-1: 0x34
2167970-2190442 rnsMfd2-1: 0x28
2190442-2221857 rnsMfd2-1: 0xD7
2418440-2445383 rnsMfd2-1: 0xCA
2445383-2470091 rnsMfd2-1: 0x34
2470091-2492562 rnsMfd2-1: 0x6
2492562-2523977 rnsMfd2-1: 0xF9
2719866-2746809 rnsMfd2-1: 0xCA
2746809-2771517 rnsMfd2-1: 0x34
2771517-2793988 rnsMfd2-1: 0x28
2793988-2825403 rnsMfd2-1: 0xD7
3025413-3052356 rnsMfd2-1: 0xCA
3052356-3077064 rnsMfd2-1: 0x34
3077064-3099535 rnsMfd2-1: 0x6
3099535-3130951 rnsMfd2-1: 0xF9
3326815-3353758 rnsMfd2-1: 0xCA
3353758-3378465 rnsMfd2-1: 0x34
3378465-3400937 rnsMfd2-1: 0x28
3400937-3432352 rnsMfd2-1: 0xD7
3631553-3658496 rnsMfd2-1: 0xCA
3658496-3683204 rnsMfd2-1: 0x34
3683204-3705675 rnsMfd2-1: 0x6
3705675-3737091 rnsMfd2-1: 0xF9
3932941-3959884 rnsMfd2-1: 0xCA
3959884-3984591 rnsMfd2-1: 0x34
3984591-4007063 rnsMfd2-1: 0x28
4007063-4038478 rnsMfd2-1: 0xD7
4194547-4194811 spi-1: DF
4196565-4196829 spi-1: CF
4198516-4198781 spi-1: 3C
4284222-4284487 spi-1: 34
4286207-4286471 spi-1: BE
4288192-4288456 spi-1: F9
4290309-4290573 spi-1: FF
4292194-4292459 spi-1: FF
4294179-4294443 spi-1: DF
4296164-4296428 spi-1: CF
4298148-4298413 spi-1: 3C
4385839-4386103 spi-1: 34
4387857-4388121 spi-1: BE
4389808-4390073 spi-1: F9
4391958-4392223 spi-1: FF
4393811-4394075 spi-1: FF
4395796-4396060 spi-1: DF
4397780-4398045 spi-1: CF
4399798-4400064 spi-1: 3C
4483486-4483751 spi-1: 34
4485669-4485934 spi-1: BE
4487456-4487720 spi-1: F9
4489440-4489705 spi-1: FF
4491458-4491723 spi-1: FF
4493443-4493707 spi-1: DF
4495428-4495692 spi-1: CF
4497412-4497677 spi-1: 3C
4583118-4583383 spi-1: 34
4585103-4585367 spi-1: BE
4587088-4587352 spi-1: F9
4589072-4589337 spi-1: FF
4591090-4591355 spi-1: FF
4593075-4593339 spi-1: DF
4595060-4595324 spi-1: CF
4597077-4597342 spi-1: 3C
4682750-4683015 spi-1: 34
4684735-4684999 spi-1: BE
4686720-4686984 spi-1: F9
4688704-4688969 spi-1: FF
4690854-4691119 spi-1: FF
4692707-4692971 spi-1: DF
4694692-4694956 spi-1: CF
4696676-4696941 spi-1: 3C
4784367-4784631 spi-1: 34
4786352-4786616 spi-1: BE
4788336-4788601 spi-1: F9
4790354-4790619 spi-1: FF
4792438-4792703 spi-1: FF
4794324-4794588 spi-1: DF
4796341-4796606 spi-1: CF
4798326-4798592 spi-1: 3C
4882014-4882279 spi-1: 34
4883999-4884263 spi-1: BE
4886116-4886382 spi-1: F9
4887968-4888233 spi-1: FF
4889986-4890251 spi-1: FF
4891971-4892235 spi-1: DF
4893956-4894220 spi-1: CF
4895940-4896205 spi-1: 3C
4981646-4981911 spi-1: 34
4983631-4983895 spi-1: BE
4985616-4985880 spi-1: F9
4987600-4987865 spi-1: FF
4989618-4989883 spi-1: FF
4991603-4991867 spi-1: DF
4993588-4993852 spi-1: CF
4995572-4995837 spi-1: 3C
5081278-5081543 spi-1: 34
5083263-5083527 spi-1: BE
5085248-5085512 spi-1: F9
5087232-5087497 spi-1: FF
5089250-5089515 spi-1: FF
5091268-5091532 spi-1: DF
5093220-5093484 spi-1: CF
5095204-5095469 spi-1: 3C
5180910-5181175 spi-1: 34
5182895-5183161 spi-1: BE
5184880-5185144 spi-1: F9
5186864-5187129 spi-1: FF
5188882-5189147 spi-1: FF
5190867-5191131 spi-1: DF
5192885-5193149 spi-1: CF
5194836-5195101 spi-1: 3C
5280542-5280807 spi-1: 34
5282527-5282793 spi-1: BE
5284512-5284776 spi-1: F9
5286596-5286860 spi-1: FF
5288514-5288779 spi-1: FF
5290499-5290763 spi-1: DF
5292484-5292748 spi-1: CF
5294468-5294733 spi-1: 3C
5380174-5380439 spi-1: 34
5382159-5382425 spi-1: BE
5384144-5384408 spi-1: F9
5386128-5386393 spi-1: FF
5388146-5388411 spi-1: FE
5390131-5390395 spi-1: DF
5392116-5392380 spi-1: CF
5394100-5394365 spi-1: 3C
5479806-5480071 spi-1: 34
5481791-5482057 spi-1: BE
5483776-5484040 spi-1: F9
5485760-5486025 spi-1: FF
5487778-5488043 spi-1: FE
5489763-5490027 spi-1: DF
5491748-5492012 spi-1: CF
5493732-5493997 spi-1: 3C
5579438-5579703 spi-1: 34
5581423-5581689 spi-1: BE
5583408-5583672 spi-1: F9
5585425-5585690 spi-1: FF
5587410-5587675 spi-1: FE
5589395-5589659 spi-1: DF
5591380-5591644 spi-1: CF
5593397-5593662 spi-1: 3C
5679070-5679335 spi-1: 34
5681055-5681321 spi-1: BE
5683040-5683304 spi-1: F9
5685057-5685322 spi-1: FF
5687075-5687340 spi-1: FE
5689027-5689291 spi-1: DF
5691012-5691276 spi-1: CF
5692996-5693261 spi-1: 3C
5778702-5778967 spi-1: 34
5780687-5780953 spi-1: BE
5782672-5782936 spi-1: F9
5784689-5784954 spi-1: FF
5786674-5786939 spi-1: FE
5788659-5788923 spi-1: DF
5790644-5790908 spi-1: CF
5792628-5792893 spi-1: 3C
5878400-5878665 spi-1: 34
5880319-5880585 spi-1: BE
5882304-5882568 spi-1: F9
5884321-5884586 spi-1: FF
5886306-5886571 spi-1: FE
5888291-5888555 spi-1: DF
5890276-5890540 spi-1: CF
5892293-5892558 spi-1: 3C
5977999-5978264 spi-1: 34
5979951-5980217 spi-1: BE
5981936-5982200 spi-1: F9
5983953-5984218 spi-1: FF
5985938-5986203 spi-1: FE
5987923-5988187 spi-1: DF
5989908-5990172 spi-1: CF
5991925-5992190 spi-1: 3C
6077598-6077863 spi-1: 34
6079583-6079849 spi-1: BE
6081568-6081832 spi-1: F9
6083585-6083850 spi-1: FF
6085570-6085835 spi-1: FE
6087555-6087819 spi-1: DF
6089540-6089804 spi-1: CF
6091557-6091822 spi-1: 3C
6177230-6177495 spi-1: 34
6179215-6179481 spi-1: BE
6181200-6181464 spi-1: F9
6183217-6183482 spi-1: FF
6185434-6185698 spi-1: FE
6187187-6187451 spi-1: DF
6189172-6189436 spi-1: CF
6191189-6191454 spi-1: 3C
6276862-6277127 spi-1: 34
6279012-6279277 spi-1: BE
6280832-6281096 spi-1: F9
6282849-6283114 spi-1: FF
6284834-6285099 spi-1: FE
6286819-6287083 spi-1: DF
6288804-6289068 spi-1: CF
6290821-6291086 spi-1: 3C
6376494-6376759 spi-1: 34
6378479-6378745 spi-1: BE
6380464-6380728 spi-1: F9
6382481-6382746 spi-1: FF
6384466-6384731 spi-1: FE
6386451-6386715 spi-1: DF
6388436-6388700 spi-1: CF
6390453-6390718 spi-1: 3C
