13819-13886 spi-1: 34
14315-14381 spi-1: BE
14819-14885 spi-1: FE
15357-15423 spi-1: FF
15812-15879 spi-1: FA
16308-16375 spi-1: FF
16812-16878 spi-1: CF
17308-17374 spi-1: 3C
39222-39289 spi-1: 34
39726-39792 spi-1: BE
40222-40288 spi-1: FE
40718-40784 spi-1: FF
41215-41280 spi-1: FA
41719-41785 spi-1: FF
42215-42281 spi-1: CF
42711-42777 spi-1: 3C
63632-63698 spi-1: 34
64128-64194 spi-1: BE
64633-64700 spi-1: FE
65129-65195 spi-1: FF
65625-65691 spi-1: FA
66121-66187 spi-1: FF
66626-66693 spi-1: CF
67122-67189 spi-1: 3C
89043-89109 spi-1: 34
89540-89605 spi-1: BE
90036-90103 spi-1: FE
90532-90599 spi-1: FF
91028-91094 spi-1: FA
91532-91598 spi-1: FF
92029-92094 spi-1: CF
92525-92592 spi-1: 3C
113446-113513 spi-1: 34
113942-114009 spi-1: BE
114446-114512 spi-1: FE
114942-115008 spi-1: FF
115480-115546 spi-1: F9
115935-116002 spi-1: FF
116439-116505 spi-1: CF
116935-117001 spi-1: 3C
138352-138418 spi-1: 34
138849-138914 spi-1: BE
139353-139419 spi-1: FE
139849-139915 spi-1: FF
140345-140411 spi-1: F9
140850-140917 spi-1: FF
141346-141413 spi-1: CF
141842-141908 spi-1: 3C
163259-163325 spi-1: 34
163755-163821 spi-1: BE
164260-164327 spi-1: FE
164756-164823 spi-1: FF
165252-165318 spi-1: F9
165748-165814 spi-1: FF
166253-166318 spi-1: CF
166749-166816 spi-1: 3C
188166-188233 spi-1: 34
188662-188728 spi-1: BE
189166-189232 spi-1: FE
189663-189728 spi-1: FF
190159-190226 spi-1: F9
190655-190722 spi-1: FF
191159-191225 spi-1: CF
191655-191721 spi-1: 3C
213073-213138 spi-1: 34
213577-213643 spi-1: BE
214073-214139 spi-1: FE
214569-214635 spi-1: FF
215065-215131 spi-1: F9
215595-215660 spi-1: FF
216066-216132 spi-1: CF
216562-216628 spi-1: 3C
237979-238045 spi-1: 34
238484-238551 spi-1: BE
238980-239047 spi-1: FE
239476-239542 spi-1: FF
239972-240038 spi-1: F9
240476-240542 spi-1: FF
240973-241040 spi-1: CF
241469-241536 spi-1: 3C
263390-263456 spi-1: 34
263886-263952 spi-1: BE
264383-264450 spi-1: FE
264879-264946 spi-1: FF
265383-265449 spi-1: F9
265879-265945 spi-1: FF
266375-266441 spi-1: CF
266872-266939 spi-1: 3C
287817-287883 spi-1: 34
288297-288363 spi-1: BE
288793-288859 spi-1: FE
289289-289355 spi-1: FF
289785-289851 spi-1: F9
290282-290349 spi-1: FF
290786-290852 spi-1: CF
291282-291348 spi-1: 3C
312699-312765 spi-1: 34
313204-313271 spi-1: BE
313700-313767 spi-1: FE
314196-314262 spi-1: FF
314692-314758 spi-1: F9
315197-315262 spi-1: FF
315718-315783 spi-1: CF
316189-316255 spi-1: 3C
337606-337672 spi-1: 34
338110-338176 spi-1: BE
338607-338672 spi-1: FE
339103-339170 spi-1: FF
339599-339666 spi-1: F9
340103-340169 spi-1: FF
340599-340665 spi-1: CF
341096-341161 spi-1: 3C
363017-363083 spi-1: 34
363513-363579 spi-1: BE
364009-364075 spi-1: FE
364580-364646 spi-1: FF
365010-365076 spi-1: F9
365506-365572 spi-1: FF
366002-366068 spi-1: CF
366498-366564 spi-1: 3C
387419-387485 spi-1: 34
387940-388006 spi-1: BE
388420-388486 spi-1: FE
388916-388982 spi-1: FF
389412-389478 spi-1: F9
389917-389984 spi-1: FF
390413-390480 spi-1: CF
390909-390975 spi-1: 3C
412831-412896 spi-1: 34
413327-413394 spi-1: BE
413823-413890 spi-1: FE
414319-414385 spi-1: FF
414823-414889 spi-1: F9
415320-415385 spi-1: FF
415857-415923 spi-1: CF
416312-416379 spi-1: 3C
437233-437300 spi-1: 34
437737-437803 spi-1: BE
438233-438299 spi-1: FE
438730-438795 spi-1: FF
439226-439293 spi-1: F9
439730-439796 spi-1: FF
440226-440292 spi-1: CF
440722-440788 spi-1: 3C
462148-462215 spi-1: 34
462660-462726 spi-1: BE
463140-463206 spi-1: FE
463636-463702 spi-1: FF
464132-464198 spi-1: F9
464695-464762 spi-1: FF
465133-465199 spi-1: CF
465629-465695 spi-1: 3C
486550-486616 spi-1: 94
487046-487112 spi-1: BE
487551-487618 spi-1: FD
488063-488129 spi-1: FF
488543-488609 spi-1: FF
489039-489105 spi-1: FF
489544-489609 spi-1: AF
490040-490107 spi-1: 9C
511953-512019 spi-1: B4
512457-512523 spi-1: BE
512953-513019 spi-1: FD
513450-513517 spi-1: FF
513946-514013 spi-1: FF
514450-514516 spi-1: FF
514946-515012 spi-1: AF
515442-515508 spi-1: BC
536860-536925 spi-1: B4
537364-537430 spi-1: BE
537860-537926 spi-1: FD
538356-538422 spi-1: FF
538852-538918 spi-1: FF
539357-539424 spi-1: FF
539853-539919 spi-1: AF
540349-540415 spi-1: BC
561270-561336 spi-1: 94
561766-561832 spi-1: BE
562271-562338 spi-1: FD
562767-562834 spi-1: FF
563263-563329 spi-1: FF
563759-563825 spi-1: FF
564264-564329 spi-1: AF
564760-564827 spi-1: 9C
586673-586739 spi-1: B4
587177-587243 spi-1: BE
587674-587739 spi-1: FD
588170-588237 spi-1: FF
588666-588733 spi-1: FF
589170-589236 spi-1: FF
589666-589732 spi-1: AF
590163-590228 spi-1: BC
611580-611647 spi-1: B4
612084-612150 spi-1: BE
612580-612646 spi-1: FD
613085-613152 spi-1: FF
613573-613638 spi-1: FF
614077-614143 spi-1: FF
614573-614639 spi-1: AF
615069-615135 spi-1: BC
636991-637058 spi-1: B4
637487-637553 spi-1: BE
637983-638049 spi-1: FD
638479-638545 spi-1: FF
638984-639051 spi-1: FF
639480-639547 spi-1: FF
639976-640042 spi-1: AF
640472-640538 spi-1: BC
661401-661467 spi-1: 34
661897-661963 spi-1: BE
662394-662461 spi-1: FD
662890-662957 spi-1: FF
663386-663452 spi-1: FF
663890-663956 spi-1: FF
664386-664452 spi-1: CF
664883-664950 spi-1: 3C
686308-686374 spi-1: 34
686804-686870 spi-1: BE
687300-687366 spi-1: FD
687796-687862 spi-1: FF
688293-688360 spi-1: FF
688805-688871 spi-1: FF
689326-689392 spi-1: CF
689789-689855 spi-1: 3C
711223-711289 spi-1: 34
711711-711778 spi-1: BE
712207-712273 spi-1: FD
712753-712820 spi-1: FF
713199-713265 spi-1: FF
713704-713771 spi-1: FF
714200-714267 spi-1: CF
714696-714762 spi-1: 3C
736121-736187 spi-1: 34
736618-736683 spi-1: BE
737114-737181 spi-1: FD
737610-737677 spi-1: FF
738106-738172 spi-1: FF
738610-738676 spi-1: FF
739107-739172 spi-1: CF
739603-739670 spi-1: 3C
761028-761094 spi-1: 34
761524-761590 spi-1: BE
762020-762086 spi-1: FD
762517-762582 spi-1: FF
763013-763080 spi-1: FF
763517-763583 spi-1: FF
764046-764112 spi-1: CF
764509-764575 spi-1: 3C
785935-786002 spi-1: 34
786431-786497 spi-1: BE
786927-786993 spi-1: FD
787423-787489 spi-1: FF
787919-787985 spi-1: FF
788424-788491 spi-1: FF
788920-788986 spi-1: CF
789441-789507 spi-1: 3C
810337-810403 spi-1: 34
810841-810907 spi-1: BE
811338-811405 spi-1: FD
811834-811901 spi-1: FF
812330-812396 spi-1: FF
812867-812933 spi-1: FF
813330-813396 spi-1: CF
813827-813894 spi-1: 3C
835748-835814 spi-1: 34
836244-836310 spi-1: BE
836740-836806 spi-1: FD
837237-837302 spi-1: FF
837733-837800 spi-1: FF
838237-838303 spi-1: FF
838733-838799 spi-1: CF
839229-839295 spi-1: 3C
860150-860216 spi-1: 34
860729-860795 spi-1: BE
861151-861217 spi-1: FD
861647-861713 spi-1: FF
862143-862209 spi-1: FF
862639-862705 spi-1: FF
863144-863211 spi-1: CF
863648-863714 spi-1: 3C
885562-885627 spi-1: 34
886058-886125 spi-1: BE
886554-886621 spi-1: FD
887050-887116 spi-1: FF
887554-887620 spi-1: FF
888051-888116 spi-1: FF
888547-888614 spi-1: CF
889043-889110 spi-1: 3C
910468-910534 spi-1: 34
910964-911030 spi-1: BE
911461-911526 spi-1: FD
911957-912024 spi-1: FF
912461-912527 spi-1: FF
912990-913056 spi-1: FF
913453-913519 spi-1: CF
913950-914015 spi-1: 3C
935375-935441 spi-1: 34
935871-935937 spi-1: BE
936367-936433 spi-1: FD
936863-936929 spi-1: FF
937368-937435 spi-1: FF
937864-937930 spi-1: FF
938360-938426 spi-1: CF
938856-938922 spi-1: 3C
960852-960918 spi-1: 34
961274-961340 spi-1: BE
961778-961844 spi-1: FD
962274-962340 spi-1: FF
962771-962838 spi-1: FF
963267-963334 spi-1: FF
963763-963829 spi-1: CF
964292-964358 spi-1: 3C
985188-985254 spi-1: 34
985684-985750 spi-1: BE
986181-986246 spi-1: FD
986677-986744 spi-1: FF
987181-987247 spi-1: FF
987677-987743 spi-1: FF
988173-988239 spi-1: CF
988670-988737 spi-1: 3C
1010095-1010161 spi-1: 34
1010591-1010657 spi-1: BE
1011087-1011153 spi-1: FD
1011583-1011649 spi-1: FF
1012088-1012155 spi-1: FF
1012584-1012650 spi-1: FF
1013113-1013179 spi-1: CF
1013576-1013642 spi-1: 3C
1035498-1035565 spi-1: 34
1035994-1036060 spi-1: BE
1036490-1036556 spi-1: FD
1037003-1037070 spi-1: FF
1037491-1037558 spi-1: FF
1037987-1038054 spi-1: FF
1038483-1038549 spi-1: CF
1038987-1039053 spi-1: 3C
450219-456955 rnsMfd2-1: 0xCA
456955-463132 rnsMfd2-1: 0x34
463132-470426 rnsMfd2-1: 0x1F
470426-476603 rnsMfd2-1: 0xE0
525840-532575 rnsMfd2-1: 0xCA
532575-538752 rnsMfd2-1: 0x34
538752-544370 rnsMfd2-1: 0x28
544370-552224 rnsMfd2-1: 0xD7
